{
 "version": 2,
 "course": "Torrey Pines South Course",
 "holeRef": "18",
 "par": 5,
 "handicap": 10,
 "sizeMeters": 613,
 "holePath": {
  "points": [
   346.599,
   50.067,
   290.425,
   305.695,
   278.539,
   491.101,
   266.39,
   562.944
  ]
 },
 "tee": {
  "x": 346.599,
  "y": 50.067
 },
 "pin": {
  "x": 266.39,
  "y": 562.944
 },
 "areas": [
  {
   "surface": "tee",
   "sourceId": "way/35678767",
   "rings": [
    {
     "points": [
      194.788,
      600.936,
      198.023,
      596.716,
      188.617,
      589.577,
      185.382,
      593.786
     ]
    }
   ]
  },
  {
   "surface": "bunker",
   "sourceId": "way/35678772",
   "rings": [
    {
     "points": [
      58.055,
      481.529,
      59.615,
      480.849,
      60.931,
      479.87,
      61.854,
      478.659,
      62.299,
      476.874,
      62.192,
      475.189,
      61.449,
      473.217,
      60.135,
      471.38,
      57.963,
      470.41,
      56.017,
      469.893,
      54.597,
      470.706,
      53.731,
      472.238,
      52.077,
      472.685,
      50.112,
      472.157,
      48.996,
      470.852,
      48.478,
      469.467,
      48.735,
      467.471,
      48.311,
      465.721,
      46.513,
      464.783,
      44.64,
      463.978,
      42.114,
      463.507,
      40.149,
      462.858,
      37.728,
      463.584,
      35.908,
      464.841,
      34.545,
      465.942,
      34.148,
      467.949,
      34.517,
      469.744,
      35.175,
      471.328,
      36.198,
      472.911,
      38.23,
      474.225,
      40.925,
      474.762,
      43.788,
      475.099,
      45.574,
      475.394,
      47.194,
      476.078,
      48.936,
      477.26,
      50.753,
      478.453,
      52.337,
      479.657,
      54.022,
      480.718,
      55.782,
      481.345
     ]
    }
   ]
  },
  {
   "surface": "bunker",
   "sourceId": "way/35678799",
   "rings": [
    {
     "points": [
      9.158,
      495.168,
      9.722,
      496.575,
      10.968,
      497.503,
      12.577,
      497.633,
      13.812,
      497.685,
      14.486,
      498.193,
      15.301,
      498.713,
      16.2,
      499.121,
      17.734,
      499.472,
      19.315,
      499.435,
      20.631,
      498.523,
      21.282,
      497.102,
      21.363,
      495.605,
      20.883,
      494.099,
      20.048,
      492.948,
      18.717,
      491.864,
      17.508,
      490.892,
      15.992,
      490.263,
      14.466,
      489.702,
      13.1,
      489.383,
      11.352,
      489.731,
      10.317,
      490.964,
      9.469,
      492.319,
      9.052,
      493.872
     ]
    }
   ]
  },
  {
   "surface": "bunker",
   "sourceId": "way/35678800",
   "rings": [
    {
     "points": [
      39.159,
      507.237,
      38.845,
      508.978,
      39.0,
      510.995,
      40.002,
      511.813,
      41.154,
      512.343,
      42.397,
      512.007,
      43.479,
      510.863,
      44.777,
      509.984,
      46.367,
      510.124,
      47.623,
      511.208,
      47.495,
      512.76,
      46.478,
      513.716,
      45.151,
      514.24,
      44.452,
      515.14,
      44.568,
      516.825,
      45.862,
      517.986,
      47.443,
      518.303,
      49.276,
      518.244,
      50.752,
      517.719,
      51.928,
      516.674,
      52.691,
      515.242,
      52.911,
      513.258,
      52.569,
      510.886,
      51.376,
      508.793,
      49.896,
      507.456,
      48.106,
      506.163,
      45.475,
      504.828,
      43.79,
      504.2,
      41.958,
      504.37,
      40.343,
      505.66
     ]
    }
   ]
  },
  {
   "surface": "rough",
   "sourceId": "way/35679009",
   "rings": [
    {
     "points": [
      107.173,
      570.034,
      0.0,
      536.627,
      0.0,
      613.0,
      184.429,
      613.0
     ]
    }
   ]
  },
  {
   "surface": "rough",
   "sourceId": "way/35679036",
   "rings": [
    {
     "points": [
      300.138,
      597.864,
      308.548,
      534.422,
      311.937,
      508.107,
      329.522,
      368.505,
      331.157,
      355.564,
      332.988,
      342.634,
      366.022,
      202.608,
      386.166,
      202.562,
      406.332,
      57.877,
      420.655,
      43.909,
      425.777,
      0.0,
      209.265,
      0.0,
      233.104,
      32.05,
      215.073,
      64.141,
      168.415,
      52.466,
      50.562,
      98.472,
      55.976,
      109.911,
      127.134,
      260.257,
      143.571,
      326.746,
      121.255,
      349.846,
      84.358,
      344.3,
      0.0,
      287.312,
      0.0,
      533.81,
      107.261,
      567.606,
      188.838,
      613.0,
      296.037,
      613.0
     ]
    }
   ]
  },
  {
   "surface": "green",
   "sourceId": "way/35799921",
   "rings": [
    {
     "points": [
      159.126,
      455.772,
      157.016,
      457.162,
      155.626,
      458.518,
      154.798,
      460.238,
      154.708,
      461.99,
      154.88,
      463.409,
      155.547,
      464.682,
      156.496,
      466.498,
      157.687,
      468.225,
      159.348,
      470.626,
      160.943,
      472.829,
      162.397,
      474.599,
      164.036,
      475.77,
      166.339,
      476.696,
      168.491,
      477.201,
      170.644,
      477.872,
      172.451,
      478.744,
      174.024,
      479.727,
      175.727,
      480.299,
      177.401,
      480.218,
      179.167,
      479.704,
      180.419,
      478.869,
      181.781,
      477.503,
      182.675,
      476.104,
      182.961,
      474.329,
      183.126,
      473.021,
      183.019,
      471.114,
      182.529,
      469.308,
      181.935,
      467.525,
      180.715,
      465.444,
      179.429,
      463.374,
      178.031,
      461.725,
      176.148,
      460.299,
      174.013,
      459.207,
      171.505,
      458.148,
      168.893,
      457.19,
      166.132,
      456.132,
      164.016,
      455.339,
      161.566,
      455.267
     ]
    }
   ]
  },
  {
   "surface": "bunker",
   "sourceId": "way/35799925",
   "rings": [
    {
     "points": [
      0.081,
      373.91,
      1.559,
      373.707,
      3.26,
      373.47,
      4.618,
      374.165,
      5.546,
      375.238,
      6.138,
      376.223,
      6.796,
      377.851,
      7.773,
      379.479,
      8.962,
      380.03,
      10.57,
      380.049,
      12.046,
      379.424,
      13.24,
      378.069,
      13.545,
      376.472,
      12.98,
      374.777,
      11.901,
      373.183,
      10.635,
      371.945,
      8.976,
      370.397,
      7.646,
      369.247,
      6.109,
      368.186,
      4.676,
      367.181,
      3.047,
      366.497,
      1.26,
      366.014,
      0.0,
      366.112,
      0.0,
      373.865
     ]
    }
   ]
  },
  {
   "surface": "bunker",
   "sourceId": "way/35800009",
   "rings": [
    {
     "points": [
      161.661,
      451.986,
      163.159,
      452.658,
      164.954,
      452.432,
      166.206,
      451.842,
      167.46,
      452.138,
      168.574,
      452.867,
      169.278,
      453.852,
      170.551,
      454.193,
      172.365,
      454.078,
      173.965,
      454.318,
      175.396,
      454.548,
      176.492,
      455.199,
      177.084,
      456.417,
      177.582,
      457.525,
      178.416,
      458.398,
      179.316,
      459.383,
      179.833,
      460.446,
      181.022,
      460.898,
      182.396,
      460.64,
      183.349,
      460.05,
      184.01,
      458.995,
      184.465,
      457.686,
      184.434,
      456.4,
      183.926,
      454.893,
      182.912,
      453.477,
      182.19,
      452.436,
      181.234,
      451.652,
      180.045,
      450.923,
      178.724,
      450.216,
      176.975,
      450.121,
      175.376,
      449.936,
      174.112,
      449.318,
      173.044,
      448.4,
      171.565,
      447.994,
      170.134,
      448.052,
      168.88,
      447.701,
      167.915,
      446.749,
      166.799,
      445.544,
      165.441,
      444.582,
      163.954,
      444.475,
      162.412,
      445.133,
      161.059,
      446.2,
      160.238,
      447.266,
      159.801,
      448.32,
      159.87,
      449.651,
      160.499,
      450.846
     ]
    }
   ]
  },
  {
   "surface": "bunker",
   "sourceId": "way/35800010",
   "rings": [
    {
     "points": [
      151.279,
      463.162,
      150.1,
      462.844,
      148.996,
      462.757,
      147.734,
      463.137,
      147.035,
      463.86,
      145.97,
      464.372,
      144.905,
      464.796,
      143.587,
      465.076,
      142.765,
      465.699,
      142.272,
      466.897,
      142.275,
      468.061,
      142.67,
      469.18,
      143.347,
      470.475,
      144.172,
      471.638,
      145.296,
      472.222,
      146.326,
      472.597,
      147.41,
      472.495,
      148.344,
      472.049,
      149.214,
      472.213,
      149.908,
      472.91,
      150.004,
      473.863,
      150.127,
      474.717,
      150.653,
      475.502,
      151.523,
      475.822,
      152.515,
      475.742,
      153.346,
      475.23,
      154.008,
      474.586,
      154.708,
      473.963,
      155.652,
      473.573,
      156.455,
      472.961,
      156.827,
      472.118,
      156.842,
      470.887,
      156.074,
      470.002,
      155.081,
      469.45,
      154.07,
      469.198,
      153.032,
      469.111,
      151.958,
      469.491,
      151.051,
      469.593,
      150.47,
      469.217,
      150.402,
      468.375,
      150.859,
      467.631,
      152.196,
      467.428,
      153.232,
      466.794,
      153.361,
      465.718,
      152.919,
      464.688,
      152.122,
      463.914
     ]
    }
   ]
  },
  {
   "surface": "tee",
   "sourceId": "way/35837779",
   "rings": [
    {
     "points": [
      223.71,
      495.397,
      221.102,
      468.077,
      211.921,
      468.94,
      214.528,
      496.261
     ]
    }
   ]
  },
  {